drug,answer,pli_score,oci_score,semantic_similarity,final_score,risk
metformin,"Metformin is primarily used to treat type 2 diabetes mellitus. It helps improve glycemic control in adults by decreasing hepatic glucose production, decreasing intestinal absorption of glucose, and improving insulin sensitivity. Metformin is not used for the treatment of type 1 diabetes mellitus. Additionally, it has been investigated for use in other conditions, such as polycystic ovary syndrome (PCOS), due to its effects on insulin sensitivity and has been explored for potential benefits in other metabolic disorders and conditions. However, its primary and FDA-approved use is for type 2 diabetes.",0.0,0.08,0.454,0.14520000000000002,Low
metformin,"Metformin is primarily used for the treatment of type 2 diabetes. It helps control blood sugar levels by improving insulin sensitivity and decreasing glucose production in the liver. Additionally, metformin is sometimes used off-label for conditions such as polycystic ovary syndrome (PCOS) and to manage weight in certain circumstances combined with lifestyle interventions. However, its primary and most common use is for managing type 2 diabetes.",0.0,0.08,0.22,0.19200000000000003,Low
metformin,"Metformin is primarily used to treat type 2 diabetes. It helps control blood sugar levels by improving the way your body handles insulin. While its primary indication is for managing type 2 diabetes, metformin is also sometimes used off-label for other conditions, such as polycystic ovary syndrome (PCOS), where it can help regulate menstrual cycles and improve insulin sensitivity. Additionally, there is ongoing research into its potential benefits for other conditions, but type 2 diabetes remains its primary and FDA-approved use.",0.0,0.08,0.315,0.17300000000000001,Low
metformin,"Metformin is primarily used to treat type 2 diabetes. It helps control blood sugar levels and is often prescribed when diet and exercise alone have not been enough to manage the condition. Metformin can also be used for polycystic ovary syndrome (PCOS) to help improve insulin sensitivity and lower insulin levels. Additionally, there is ongoing research into its potential use in other areas, such as weight management in people with diabetes and prediabetes, and for its potential anti-aging effects, though these are not standard uses.",0.239,0.447,0.073,0.4702,Medium
metformin,"The provided context does not contain information about metformin. However, I can provide general information about metformin. Metformin is primarily used to treat type 2 diabetes. It helps control blood sugar levels and is often prescribed to improve insulin sensitivity and reduce glucose production in the liver. Additionally, metformin is sometimes used for polycystic ovary syndrome (PCOS) and has been studied for its potential benefits in weight management and other metabolic disorders.",0.644,0.673,0.25,0.67825,High
